<?xml version="1.0" encoding="UTF-8"?>
<passions xmlns:xsi="http://www.w3.org/2001/XMLSchema-instance"
	xsi:noNamespaceSchemaLocation="validation/pendragon-model-passion.xsd">
	<passion repeatable="true">
		<name>amor</name>
		<descriptor>person</descriptor>
	</passion>
	<passion repeatable="true">
		<name>concern</name>
		<descriptor>group</descriptor>
	</passion>
	<passion repeatable="true">
		<name>fear</name>
		<descriptor>creature_event</descriptor>
	</passion>
	<passion repeatable="true">
		<name>hate</name>
		<descriptor>person_group_nation</descriptor>
	</passion>
	<passion>
		<name>hospitality</name>
	</passion>
	<passion>
		<name>honor</name>
	</passion>
	<passion repeatable="true">
		<name>loyalty</name>
		<descriptor>person_group</descriptor>
	</passion>
	<passion repeatable="true">
		<name>love</name>
		<descriptor>person_group_god</descriptor>
	</passion>
</passions>